id,name,url,category,subcategory,description,keyFeatures,startingPrice,easeOfUse,setupTime,integrations,useCase,industryROI,specialization,specializationScore,founded,isAINative,urlStatus
"45","BusinessAI Pro Services","https://business-ai-pro.com","Professional Services","Business Analytics","Professional AI business services with consulting analytics accounting automation and professional services optimization","Advanced AI analytics Professional-grade platform Industry-specific optimization","Starting at $49/month","8","1-2 hours","Business systems Professional platforms Service management","Professional Services professionals using advanced AI for professional ai business services with consulting analytics accounting automation and professional services optimization","300-500%","Professional AI business services with consulting analytics accounting automation and professional services optimization","10","2024","true",""
"46","ProfessionalAI Platform","https://professional-ai.com","Professional Services","Professional Platform","Comprehensive AI professional services with business consulting legal analysis and services optimization","Advanced AI analytics Professional-grade platform Industry-specific optimization","Starting at $49/month","8","1-2 hours","Business systems Professional platforms Service management","Professional Services professionals using advanced AI for comprehensive ai professional services with business consulting legal analysis and services optimization","300-500%","Comprehensive AI professional services with business consulting legal analysis and services optimization","10","2024","true",""
"47","ServiceAI Analytics","https://service-analytics.ai","Professional Services","Consulting Services","Advanced AI professional services with business analysis and consulting optimization","Advanced AI analytics Professional-grade platform Industry-specific optimization","Starting at $49/month","8","1-2 hours","Business systems Professional platforms Service management","Professional Services professionals using advanced AI for advanced ai professional services with business analysis and consulting optimization","300-500%","Advanced AI professional services with business analysis and consulting optimization","10","2023","true",""
"48","CorporateAI Pro","https://corporate-ai.com","Professional Services","Corporate Services","Expert AI business services with professional consulting and corporate analysis","Advanced AI analytics Professional-grade platform Industry-specific optimization","Starting at $49/month","8","1-2 hours","Business systems Professional platforms Service management","Professional Services professionals using advanced AI for expert ai business services with professional consulting and corporate analysis","300-500%","Expert AI business services with professional consulting and corporate analysis","10","2024","true",""
"49","ConsultingAI Systems","https://consulting-ai-systems.com","Professional Services","Professional Platform","Specialized AI consulting services with business analysis and professional optimization","Advanced AI analytics Professional-grade platform Industry-specific optimization","Starting at $49/month","8","1-2 hours","Business systems Professional platforms Service management","Professional Services professionals using advanced AI for specialized ai consulting services with business analysis and professional optimization","300-500%","Specialized AI consulting services with business analysis and professional optimization","10","2024","true",""
"50","PawHealth Monitor","https://pawhealth.ai","Pet Care & Services","Pet Health Monitoring","AI wearable health monitoring for pets","Advanced AI analytics Professional-grade platform Industry-specific optimization","Starting at $49/month","8","1-2 hours","Veterinary systems Pet platforms Health monitoring","Pet Care & Services professionals using advanced AI for ai wearable health monitoring for pets","300-500%","AI wearable health monitoring for pets","7.5","2024","true",""
"51","SmartShop AI","https://smartshopai.com","E-commerce & Retail","Online Stores","Specialized AI tool for inventory forecasting optimization in the E-commerce & Retail industry","Intelligent inventory forecasting Automated inventory forecasting analysis Real-time inventory forecasting optimization","Starting at $39/month","8","1 hour","E-commerce platforms Inventory systems Payment processors","E-commerce & Retail professionals using advanced AI for inventory forecasting","150-350%","inventory forecasting","8.9","2024","true","valid"
"52","ProStore Pro","https://prostorepro.com","E-commerce & Retail","Inventory Management","AI-powered customer segmentation platform designed specifically for E-commerce & Retail professionals","Intelligent customer segmentation Automated customer segmentation analysis Real-time customer segmentation optimization","Starting at $59/month","9","1-2 hours","E-commerce platforms Inventory systems Payment processors","E-commerce & Retail professionals using advanced AI for customer segmentation","150-350%","customer segmentation","8.5","2024","true","valid"
"53","AICommerce Analytics","https://aicommerceanalytics.com","E-commerce & Retail","Customer Analytics","AI-powered dynamic pricing platform designed specifically for E-commerce & Retail professionals","Intelligent dynamic pricing Automated dynamic pricing analysis Real-time dynamic pricing optimization","Starting at $79/month","8","2 hours","E-commerce platforms Inventory systems Payment processors","E-commerce & Retail professionals using advanced AI for dynamic pricing","150-350%","dynamic pricing","8.5","2024","true","valid"
"54","AutoRetail Platform","https://autoretailplatform.com","E-commerce & Retail","Product Recommendations","Specialized AI tool for product categorization optimization in the E-commerce & Retail industry","Intelligent product categorization Automated product categorization analysis Real-time product categorization optimization","Starting at $99/month","9","30 minutes","E-commerce platforms Inventory systems Payment processors","E-commerce & Retail professionals using advanced AI for product categorization","150-350%","product categorization","8.5","2024","true","valid"
"55","SmartProperty AI","https://smartpropertyai.com","Real Estate & Property","Property Valuation","Professional property valuation assistant with machine learning capabilities for Real Estate & Property","Intelligent property valuation Automated property valuation analysis Real-time property valuation optimization","Starting at $79/month","8","30 minutes","CRM systems MLS platforms Property management tools","Real Estate & Property professionals using advanced AI for property valuation","200-450%","property valuation","8.5","2024","true","valid"
"56","ProRealty Pro","https://prorealtypro.com","Real Estate & Property","Market Analysis","Specialized AI tool for market trend analysis optimization in the Real Estate & Property industry","Intelligent market trend analysis Automated market trend analysis analysis Real-time market trend analysis optimization","Starting at $99/month","8","1 hour","CRM systems MLS platforms Property management tools","Real Estate & Property professionals using advanced AI for market trend analysis","200-450%","market trend analysis","8.8","2024","true","valid"
"57","AIEstate Analytics","https://aiestateanalytics.com","Real Estate & Property","Property Management","AI-powered rental optimization platform designed specifically for Real Estate & Property professionals","Intelligent rental optimization Automated rental optimization analysis Real-time rental optimization optimization","Starting at $119/month","9","45 minutes","CRM systems MLS platforms Property management tools","Real Estate & Property professionals using advanced AI for rental optimization","200-450%","rental optimization","9","2024","true","valid"
"58","AutoHome Platform","https://autohomeplatform.com","Real Estate & Property","Real Estate Marketing","Professional lead qualification assistant with machine learning capabilities for Real Estate & Property","Intelligent lead qualification Automated lead qualification analysis Real-time lead qualification optimization","Starting at $139/month","9","1 hour","CRM systems MLS platforms Property management tools","Real Estate & Property professionals using advanced AI for lead qualification","200-450%","lead qualification","8.5","2024","true","valid"
"59","SmartFit AI","https://smartfitai.com","Fitness & Sports","Personal Training","Industry-leading AI platform for workout optimization enhancement in Fitness & Sports","Intelligent workout optimization Automated workout optimization analysis Real-time workout optimization optimization","Starting at $29/month","7","2 hours","Fitness apps Wearable devices Gym management software","Fitness & Sports professionals using advanced AI for workout optimization","120-300%","workout optimization","9","2024","true","valid"
"60","ProSport Pro","https://prosportpro.com","Fitness & Sports","Sports Analytics","Specialized AI tool for performance analytics optimization in the Fitness & Sports industry","Intelligent performance analytics Automated performance analytics analysis Real-time performance analytics optimization","Starting at $49/month","8","2 hours","Fitness apps Wearable devices Gym management software","Fitness & Sports professionals using advanced AI for performance analytics","120-300%","performance analytics","8.8","2024","true","valid"
"61","AIGym Analytics","https://aigymanalytics.com","Fitness & Sports","Fitness Coaching","Advanced nutrition planning solution with intelligent automation for Fitness & Sports businesses","Intelligent nutrition planning Automated nutrition planning analysis Real-time nutrition planning optimization","Starting at $69/month","9","45 minutes","Fitness apps Wearable devices Gym management software","Fitness & Sports professionals using advanced AI for nutrition planning","120-300%","nutrition planning","8.5","2024","true","valid"
"62","AutoTraining Platform","https://autotrainingplatform.com","Fitness & Sports","Gym Management","Industry-leading AI platform for member engagement enhancement in Fitness & Sports","Intelligent member engagement Automated member engagement analysis Real-time member engagement optimization","Starting at $89/month","9","1 hour","Fitness apps Wearable devices Gym management software","Fitness & Sports professionals using advanced AI for member engagement","120-300%","member engagement","8.5","2023","true","valid"
"63","SmartLearn AI","https://smartlearnai.com","Education & Training","Online Learning","Specialized AI tool for personalized learning optimization in the Education & Training industry","Intelligent personalized learning Automated personalized learning analysis Real-time personalized learning optimization","Starting at $49/month","8","45 minutes","LMS platforms Educational tools Assessment software","Education & Training professionals using advanced AI for personalized learning","180-380%","personalized learning","8.5","2024","true","valid"
"64","ProEdu Pro","https://proedupro.com","Education & Training","Training Development","Industry-leading AI platform for content creation enhancement in Education & Training","Intelligent content creation Automated content creation analysis Real-time content creation optimization","Starting at $69/month","9","30 minutes","LMS platforms Educational tools Assessment software","Education & Training professionals using advanced AI for content creation","180-380%","content creation","8.5","2023","true","valid"
"65","AITraining Analytics","https://aitraininganalytics.com","Education & Training","Student Analytics","Professional progress tracking assistant with machine learning capabilities for Education & Training","Intelligent progress tracking Automated progress tracking analysis Real-time progress tracking optimization","Starting at $89/month","8","1 hour","LMS platforms Educational tools Assessment software","Education & Training professionals using advanced AI for progress tracking","180-380%","progress tracking","8.5","2024","true","valid"
"66","AutoSkill Platform","https://autoskillplatform.com","Education & Training","Course Creation","AI-powered skill assessment platform designed specifically for Education & Training professionals","Intelligent skill assessment Automated skill assessment analysis Real-time skill assessment optimization","Starting at $109/month","7","1 hour","LMS platforms Educational tools Assessment software","Education & Training professionals using advanced AI for skill assessment","180-380%","skill assessment","8.5","2024","true","valid"
"67","SmartManu AI","https://smartmanuai.com","Manufacturing & Operations","Quality Control","Advanced quality inspection solution with intelligent automation for Manufacturing & Operations businesses","Intelligent quality inspection Automated quality inspection analysis Real-time quality inspection optimization","Starting at $99/month","8","2 hours","ERP systems Manufacturing platforms Quality systems","Manufacturing & Operations professionals using advanced AI for quality inspection","250-500%","quality inspection","8.8","2023","true","valid"
"68","ProOps Pro","https://proopspro.com","Manufacturing & Operations","Production Optimization","AI-powered production scheduling platform designed specifically for Manufacturing & Operations professionals","Intelligent production scheduling Automated production scheduling analysis Real-time production scheduling optimization","Starting at $119/month","7","15 minutes","ERP systems Manufacturing platforms Quality systems","Manufacturing & Operations professionals using advanced AI for production scheduling","250-500%","production scheduling","8.8","2024","true","valid"
"69","AIProduction Analytics","https://aiproductionanalytics.com","Manufacturing & Operations","Supply Chain","AI-powered predictive maintenance platform designed specifically for Manufacturing & Operations professionals","Intelligent predictive maintenance Automated predictive maintenance analysis Real-time predictive maintenance optimization","Starting at $139/month","9","45 minutes","ERP systems Manufacturing platforms Quality systems","Manufacturing & Operations professionals using advanced AI for predictive maintenance","250-500%","predictive maintenance","8.8","2024","true","valid"
"70","AutoFactory Platform","https://autofactoryplatform.com","Manufacturing & Operations","Equipment Monitoring","Professional workflow optimization assistant with machine learning capabilities for Manufacturing & Operations","Intelligent workflow optimization Automated workflow optimization analysis Real-time workflow optimization optimization","Starting at $159/month","8","1-2 hours","ERP systems Manufacturing platforms Quality systems","Manufacturing & Operations professionals using advanced AI for workflow optimization","250-500%","workflow optimization","9.3","2024","true","valid"
"71","SmartLogistics AI","https://smartlogisticsai.com","Transportation & Logistics","Route Optimization","Professional route optimization assistant with machine learning capabilities for Transportation & Logistics","Intelligent route optimization Automated route optimization analysis Real-time route optimization optimization","Starting at $69/month","7","45 minutes","Fleet management GPS systems Warehouse systems","Transportation & Logistics professionals using advanced AI for route optimization","200-400%","route optimization","9","2024","true","valid"
"72","ProTransport Pro","https://protransportpro.com","Transportation & Logistics","Fleet Management","Industry-leading AI platform for fleet tracking enhancement in Transportation & Logistics","Intelligent fleet tracking Automated fleet tracking analysis Real-time fleet tracking optimization","Starting at $89/month","7","1 hour","Fleet management GPS systems Warehouse systems","Transportation & Logistics professionals using advanced AI for fleet tracking","200-400%","fleet tracking","8.5","2023","true","valid"
"73","AIFleet Analytics","https://aifleetanalytics.com","Transportation & Logistics","Delivery Analytics","Professional delivery prediction assistant with machine learning capabilities for Transportation & Logistics","Intelligent delivery prediction Automated delivery prediction analysis Real-time delivery prediction optimization","Starting at $109/month","9","30 minutes","Fleet management GPS systems Warehouse systems","Transportation & Logistics professionals using advanced AI for delivery prediction","200-400%","delivery prediction","8.9","2024","true","valid"
"74","AutoRoute Platform","https://autorouteplatform.com","Transportation & Logistics","Warehouse Operations","Industry-leading AI platform for warehouse automation enhancement in Transportation & Logistics","Intelligent warehouse automation Automated warehouse automation analysis Real-time warehouse automation optimization","Starting at $129/month","9","1-2 hours","Fleet management GPS systems Warehouse systems","Transportation & Logistics professionals using advanced AI for warehouse automation","200-400%","warehouse automation","8.9","2023","true","valid"
"75","SmartFinance AI","https://smartfinanceai.com","Finance & Insurance","Risk Assessment","Advanced risk modeling solution with intelligent automation for Finance & Insurance businesses","Intelligent risk modeling Automated risk modeling analysis Real-time risk modeling optimization","Starting at $89/month","9","1-2 hours","Financial software Banking systems Insurance platforms","Finance & Insurance professionals using advanced AI for risk modeling","250-550%","risk modeling","8.8","2023","true","valid"
"76","ProMoney Pro","https://promoneypro.com","Finance & Insurance","Financial Planning","Specialized AI tool for financial forecasting optimization in the Finance & Insurance industry","Intelligent financial forecasting Automated financial forecasting analysis Real-time financial forecasting optimization","Starting at $109/month","8","1-2 hours","Financial software Banking systems Insurance platforms","Finance & Insurance professionals using advanced AI for financial forecasting","250-550%","financial forecasting","9.2","2024","true","valid"
"77","AICapital Analytics","https://aicapitalanalytics.com","Finance & Insurance","Investment Analysis","Advanced portfolio optimization solution with intelligent automation for Finance & Insurance businesses","Intelligent portfolio optimization Automated portfolio optimization analysis Real-time portfolio optimization optimization","Starting at $129/month","9","1 hour","Financial software Banking systems Insurance platforms","Finance & Insurance professionals using advanced AI for portfolio optimization","250-550%","portfolio optimization","9.3","2024","true","valid"
"78","AutoInsurance Platform","https://autoinsuranceplatform.com","Finance & Insurance","Insurance Claims","AI-powered claims processing platform designed specifically for Finance & Insurance professionals","Intelligent claims processing Automated claims processing analysis Real-time claims processing optimization","Starting at $149/month","8","45 minutes","Financial software Banking systems Insurance platforms","Finance & Insurance professionals using advanced AI for claims processing","250-550%","claims processing","8.8","2024","true","valid"
"79","SmartMedia AI","https://smartmediaai.com","Entertainment & Media","Content Creation","Professional content optimization assistant with machine learning capabilities for Entertainment & Media","Intelligent content optimization Automated content optimization analysis Real-time content optimization optimization","Starting at $39/month","8","1 hour","Media platforms Social networks Production tools","Entertainment & Media professionals using advanced AI for content optimization","150-350%","content optimization","9","2023","true","valid"
"80","ProContent Pro","https://procontentpro.com","Entertainment & Media","Audience Analytics","Advanced audience engagement solution with intelligent automation for Entertainment & Media businesses","Intelligent audience engagement Automated audience engagement analysis Real-time audience engagement optimization","Starting at $59/month","9","2 hours","Media platforms Social networks Production tools","Entertainment & Media professionals using advanced AI for audience engagement","150-350%","audience engagement","8.5","2023","true","valid"
"81","AIEntertainment Analytics","https://aientertainmentanalytics.com","Entertainment & Media","Media Production","AI-powered production planning platform designed specifically for Entertainment & Media professionals","Intelligent production planning Automated production planning analysis Real-time production planning optimization","Starting at $79/month","8","2 hours","Media platforms Social networks Production tools","Entertainment & Media professionals using advanced AI for production planning","150-350%","production planning","8.5","2024","true","valid"
"82","AutoCreative Platform","https://autocreativeplatform.com","Entertainment & Media","Event Management","Professional event analytics assistant with machine learning capabilities for Entertainment & Media","Intelligent event analytics Automated event analytics analysis Real-time event analytics optimization","Starting at $99/month","8","2 hours","Media platforms Social networks Production tools","Entertainment & Media professionals using advanced AI for event analytics","150-350%","event analytics","8.8","2024","true","valid"
"83","SmartCommunity AI","https://smartcommunityai.com","Non-Profit & Community","Donor Management","Industry-leading AI platform for donor prediction enhancement in Non-Profit & Community","Intelligent donor prediction Automated donor prediction analysis Real-time donor prediction optimization","Starting at $29/month","7","15 minutes","CRM systems Fundraising platforms Volunteer systems","Non-Profit & Community professionals using advanced AI for donor prediction","200-400%","donor prediction","8.9","2023","true","valid"
"84","ProNonprofit Pro","https://prononprofitpro.com","Non-Profit & Community","Volunteer Coordination","Professional volunteer matching assistant with machine learning capabilities for Non-Profit & Community","Intelligent volunteer matching Automated volunteer matching analysis Real-time volunteer matching optimization","Starting at $49/month","9","2 hours","CRM systems Fundraising platforms Volunteer systems","Non-Profit & Community professionals using advanced AI for volunteer matching","200-400%","volunteer matching","8.5","2023","true","valid"
"85","AIImpact Analytics","https://aiimpactanalytics.com","Non-Profit & Community","Impact Measurement","AI-powered impact tracking platform designed specifically for Non-Profit & Community professionals","Intelligent impact tracking Automated impact tracking analysis Real-time impact tracking optimization","Starting at $69/month","9","15 minutes","CRM systems Fundraising platforms Volunteer systems","Non-Profit & Community professionals using advanced AI for impact tracking","200-400%","impact tracking","8.5","2024","true","valid"
"86","AutoSocial Platform","https://autosocialplatform.com","Non-Profit & Community","Fundraising","AI-powered campaign optimization platform designed specifically for Non-Profit & Community professionals","Intelligent campaign optimization Automated campaign optimization analysis Real-time campaign optimization optimization","Starting at $89/month","7","30 minutes","CRM systems Fundraising platforms Volunteer systems","Non-Profit & Community professionals using advanced AI for campaign optimization","200-400%","campaign optimization","9","2024","true","valid"
"87","SmartFarm AI","https://smartfarmai.com","Agriculture & Farming","Crop Management","Advanced crop optimization solution with intelligent automation for Agriculture & Farming businesses","Intelligent crop optimization Automated crop optimization analysis Real-time crop optimization optimization","Starting at $59/month","7","1 hour","Farm management IoT sensors Weather systems","Agriculture & Farming professionals using advanced AI for crop optimization","180-400%","crop optimization","9","2023","true","valid"
"88","ProAgri Pro","https://proagripro.com","Agriculture & Farming","Livestock Monitoring","Industry-leading AI platform for livestock health enhancement in Agriculture & Farming","Intelligent livestock health Automated livestock health analysis Real-time livestock health optimization","Starting at $79/month","7","1 hour","Farm management IoT sensors Weather systems","Agriculture & Farming professionals using advanced AI for livestock health","180-400%","livestock health","8.5","2024","true","valid"
"89","AICrop Analytics","https://aicropanalytics.com","Agriculture & Farming","Farm Analytics","Professional yield prediction assistant with machine learning capabilities for Agriculture & Farming","Intelligent yield prediction Automated yield prediction analysis Real-time yield prediction optimization","Starting at $99/month","8","1 hour","Farm management IoT sensors Weather systems","Agriculture & Farming professionals using advanced AI for yield prediction","180-400%","yield prediction","8.9","2024","true","valid"
"90","AutoHarvest Platform","https://autoharvestplatform.com","Agriculture & Farming","Soil Analysis","Specialized AI tool for soil monitoring optimization in the Agriculture & Farming industry","Intelligent soil monitoring Automated soil monitoring analysis Real-time soil monitoring optimization","Starting at $119/month","7","30 minutes","Farm management IoT sensors Weather systems","Agriculture & Farming professionals using advanced AI for soil monitoring","180-400%","soil monitoring","8.5","2024","true","valid"
