id,name,url,category,subcategory,description,keyFeatures,startingPrice,easeOfUse,setupTime,integrations,useCase,industryROI,specialization,specializationScore,founded,isAINative,urlStatus
"134","QuantumPublic Analytics","https://quantumpublicanalytics.com","Government & Public Sector","Policy Analysis","Advanced machine learning solution delivering policy impact analysis automation for Government & Public Sector industry leaders","Enterprise policy impact analysis automation Advanced policy impact analysis intelligence Predictive policy impact analysis modeling","Starting at $129/month","8","2-3 days","Government systems Public databases Emergency platforms","Government & Public Sector professionals using advanced AI for policy impact analysis","200-500%","policy impact analysis","9.3","2023","true","valid"
"135","NeuralCivic Insights","https://neuralcivicinsights.com","Government & Public Sector","Resource Allocation","Professional AI system optimizing resource planning processes for Government & Public Sector organizations","Enterprise resource planning automation Advanced resource planning intelligence Predictive resource planning modeling","Starting at $159/month","8","1 day","Government systems Public databases Emergency platforms","Government & Public Sector professionals using advanced AI for resource planning","200-500%","resource planning","8.9","2024","true","valid"
"136","CognitiveMunicipal Solutions","https://cognitivemunicipalsolutions.com","Government & Public Sector","Emergency Response","Next-generation AI solution revolutionizing emergency prediction in the Government & Public Sector sector","Enterprise emergency prediction automation Advanced emergency prediction intelligence Predictive emergency prediction modeling","Starting at $189/month","8","1-2 hours","Government systems Public databases Emergency platforms","Government & Public Sector professionals using advanced AI for emergency prediction","200-500%","emergency prediction","9.5","2024","true","valid"
"137","NexusRetail Intelligence","https://nexusretailintelligence.com","Retail & Consumer Goods","Demand Forecasting","Enterprise-grade AI platform for demand prediction specifically engineered for Retail & Consumer Goods professionals","Enterprise demand prediction automation Advanced demand prediction intelligence Predictive demand prediction modeling","Starting at $69/month","9","1-2 hours","Retail systems POS platforms Supply chain tools","Retail & Consumer Goods professionals using advanced AI for demand prediction","180-420%","demand prediction","9.3","2023","true","valid"
"138","QuantumConsumer Analytics","https://quantumconsumeranalytics.com","Retail & Consumer Goods","Price Optimization","Enterprise-grade AI platform for dynamic pricing specifically engineered for Retail & Consumer Goods professionals","Enterprise dynamic pricing automation Advanced dynamic pricing intelligence Predictive dynamic pricing modeling","Starting at $99/month","8","1-2 hours","Retail systems POS platforms Supply chain tools","Retail & Consumer Goods professionals using advanced AI for dynamic pricing","180-420%","dynamic pricing","8.7","2023","true","valid"
"139","NeuralCommerce Insights","https://neuralcommerceinsights.com","Retail & Consumer Goods","Customer Intelligence","Professional AI system optimizing customer lifetime value processes for Retail & Consumer Goods organizations","Enterprise customer lifetime value automation Advanced customer lifetime value intelligence Predictive customer lifetime value modeling","Starting at $129/month","7","1 week","Retail systems POS platforms Supply chain tools","Retail & Consumer Goods professionals using advanced AI for customer lifetime value","180-420%","customer lifetime value","8.7","2024","true","valid"
"140","CognitiveMarket Solutions","https://cognitivemarketsolutions.com","Retail & Consumer Goods","Inventory Management","Enterprise-grade AI platform for inventory optimization specifically engineered for Retail & Consumer Goods professionals","Enterprise inventory optimization automation Advanced inventory optimization intelligence Predictive inventory optimization modeling","Starting at $159/month","9","2-3 hours","Retail systems POS platforms Supply chain tools","Retail & Consumer Goods professionals using advanced AI for inventory optimization","180-420%","inventory optimization","9.2","2023","true","valid"
"145","IntelligentAudit Platform","https://intelligentauditplatform.com","Legal & Compliance","Risk Assessment","Next-generation AI solution revolutionizing IP portfolio management in the Legal & Compliance sector","Enterprise IP portfolio management automation Advanced IP portfolio management intelligence Predictive IP portfolio management modeling","Starting at $269/month","8","2-3 hours","Legal software Case management systems Compliance platforms","Legal & Compliance professionals using advanced AI for IP portfolio management","300-700%","IP portfolio management","9.1","2024","true","valid"
