id,name,url,category,subcategory,description,keyFeatures,startingPrice,easeOfUse,setupTime,integrations,useCase,industryROI,specialization,specializationScore,founded,isAINative,urlStatus
"1","VetFlow AI","https://vetflow.ai","Pet Care & Services","Veterinary Clinics","AI-powered veterinary clinic management and diagnostic assistance","Automated diagnostics workflow optimization real-time patient monitoring","Starting at $89/month","9","30 minutes","Veterinary management systems Pet insurance platforms Scheduling software","Veterinary clinics using AI for automated diagnostics workflow optimization","200-400%","Automated diagnostics workflow optimization","10","2023","true",""
"2","PawPrint AI","https://pawprint.ai","Pet Care & Services","Pet Grooming","AI grooming recommendations and appointment scheduling for pet salons","Smart appointment booking grooming style recommendations customer management","From $49/month","8","1 hour","Pet salon software Booking systems Payment processors","Pet grooming salons using AI for smart appointment booking grooming style recommendations","200-400%","Smart appointment booking grooming style recommendations","9.5","2024","true",""
"3","PetTrainer AI Pro","https://pettrainer-ai.com","Pet Care & Services","Pet Training Services","Advanced AI pet behavioral analysis and training program optimization","AI behavioral analysis training program optimization progress tracking","Starting at $59/month","8","45 minutes","Training platforms Pet behavior apps Veterinary systems","Pet training services using AI for behavioral analysis training program optimization","200-400%","AI behavioral analysis training program optimization","9.4","2024","true",""
"4","PetInsure AI","https://petinsure-ai.com","Pet Care & Services","Pet Insurance","AI-driven pet insurance claim processing and risk assessment platform","Automated claim processing risk assessment policy optimization","From $39/month","7","2 hours","Insurance systems Veterinary platforms Payment processors","Pet insurance companies using AI for automated claim processing risk assessment","200-400%","Automated claim processing risk assessment","7.2","2023","true",""
"5","PetSitter Pro AI","https://petsitter-pro.ai","Pet Care & Services","Pet Care Services","AI matching platform for pet sitters with behavioral compatibility analysis","Smart matching behavioral compatibility real-time updates","Starting at $29/month","8","1 hour","Pet care platforms Booking systems Mobile apps","Pet sitting services using AI for smart matching behavioral compatibility","200-400%","Smart matching behavioral compatibility","7","2024","true",""
"6","VetAI Diagnostics Pro","https://vetai-diagnostics.com","Pet Care & Services","Animal Wellness","Advanced AI veterinary diagnostic imaging analysis with real-time pet health monitoring and behavioral training insights","Advanced AI analytics Professional-grade platform Industry-specific optimization","Starting at $49/month","8","1-2 hours","Veterinary systems Pet platforms Health monitoring","Pet Care & Services professionals using advanced AI for advanced ai veterinary diagnostic imaging analysis with real-time pet health monitoring and behavioral training insights","300-500%","Advanced AI veterinary diagnostic imaging analysis with real-time pet health monitoring and behavioral training insights","9.5","2024","true",""
"7","PetCare AI Analytics","https://petcare-analytics.ai","Pet Care & Services","Pet Health Monitoring","Comprehensive AI pet health monitoring with veterinary appointment scheduling and grooming recommendations","Advanced AI analytics Professional-grade platform Industry-specific optimization","Starting at $49/month","8","1-2 hours","Veterinary systems Pet platforms Health monitoring","Pet Care & Services professionals using advanced AI for comprehensive ai pet health monitoring with veterinary appointment scheduling and grooming recommendations","300-500%","Comprehensive AI pet health monitoring with veterinary appointment scheduling and grooming recommendations","9","2024","true",""
"8","AnimalHealth AI Pro","https://animalhealth-ai.com","Pet Care & Services","Pet Care Analytics","Professional AI animal health diagnostics with veterinary practice management and pet behavioral analysis","Advanced AI analytics Professional-grade platform Industry-specific optimization","Starting at $49/month","8","1-2 hours","Veterinary systems Pet platforms Health monitoring","Pet Care & Services professionals using advanced AI for professional ai animal health diagnostics with veterinary practice management and pet behavioral analysis","300-500%","Professional AI animal health diagnostics with veterinary practice management and pet behavioral analysis","10","2023","true",""
"9","PlumberBot AI","https://plumberbot.ai","Home Services & Contractors","Plumbing","AI plumbing diagnostic tool with leak detection and repair recommendations","Leak detection diagnostic analysis repair recommendations","Starting at $79/month","8","1 hour","CRM systems Scheduling platforms Payment processors","Plumbing contractors using AI for leak detection diagnostic analysis","150-350%","Leak detection diagnostic analysis","9.8","2024","true",""
"10","ElectricianAI Pro","https://electrician-ai.com","Home Services & Contractors","Electrical","AI electrical system analysis and troubleshooting for contractors","Circuit analysis troubleshooting recommendations safety assessments","From $69/month","8","45 minutes","CRM systems Scheduling platforms Payment processors","Electrical contractors using AI for circuit analysis troubleshooting recommendations","150-350%","Circuit analysis troubleshooting recommendations","9.5","2023","true",""
"11","RoofScope AI","https://roofscope.ai","Home Services & Contractors","Roofing","AI roof damage assessment using drone imagery and satellite data","Drone analysis damage assessment repair estimates","Starting at $99/month","7","2 hours","CRM systems Scheduling platforms Payment processors","Roofing contractors using AI for drone analysis damage assessment","150-350%","Drone analysis damage assessment","9.5","2024","true",""
"12","TradeAI Pro Services","https://tradeai-pro.com","Home Services & Contractors","Professional Services","Professional AI home services platform with HVAC diagnostics plumbing analysis and electrical maintenance optimization","Advanced AI analytics Professional-grade platform Industry-specific optimization","Starting at $49/month","8","1-2 hours","Contractor platforms Service systems Home management","Home Services & Contractors professionals using advanced AI for professional ai home services platform with hvac diagnostics plumbing analysis and electrical maintenance optimization","250-450%","Professional AI home services platform with HVAC diagnostics plumbing analysis and electrical maintenance optimization","10","2024","true",""
"13","HomeServiceAI Pro","https://homeservice-ai.com","Home Services & Contractors","Service Analytics","Comprehensive AI home contractor services with repair diagnostics installation planning and maintenance scheduling","Advanced AI analytics Professional-grade platform Industry-specific optimization","Starting at $49/month","8","1-2 hours","Contractor platforms Service systems Home management","Home Services & Contractors professionals using advanced AI for comprehensive ai home contractor services with repair diagnostics installation planning and maintenance scheduling","250-450%","Comprehensive AI home contractor services with repair diagnostics installation planning and maintenance scheduling","10","2024","true",""
"14","ContractorAI Systems","https://contractor-ai.com","Home Services & Contractors","Professional Services","Advanced AI contractor services with home repair diagnostics installation analysis and service optimization","Advanced AI analytics Professional-grade platform Industry-specific optimization","Starting at $49/month","8","1-2 hours","Contractor platforms Service systems Home management","Home Services & Contractors professionals using advanced AI for advanced ai contractor services with home repair diagnostics installation analysis and service optimization","250-450%","Advanced AI contractor services with home repair diagnostics installation analysis and service optimization","10","2023","true",""
"15","ServiceProAI Platform","https://servicepro-ai.com","Home Services & Contractors","Home Diagnostics","Professional AI home services with contractor scheduling repair analysis and maintenance monitoring","Advanced AI analytics Professional-grade platform Industry-specific optimization","Starting at $49/month","8","1-2 hours","Contractor platforms Service systems Home management","Home Services & Contractors professionals using advanced AI for professional ai home services with contractor scheduling repair analysis and maintenance monitoring","250-450%","Professional AI home services with contractor scheduling repair analysis and maintenance monitoring","10","2024","true",""
"16","HomeRepairAI Pro","https://homerepair-ai.com","Home Services & Contractors","Contractor Platform","Specialized AI home repair services with contractor diagnostics and service optimization","Advanced AI analytics Professional-grade platform Industry-specific optimization","Starting at $49/month","8","1-2 hours","Contractor platforms Service systems Home management","Home Services & Contractors professionals using advanced AI for specialized ai home repair services with contractor diagnostics and service optimization","250-450%","Specialized AI home repair services with contractor diagnostics and service optimization","10","2024","true",""
"17","TradeMasterAI","https://trademaster-ai.com","Home Services & Contractors","Service Analytics","Expert AI home services platform with professional contractor analysis and repair optimization","Advanced AI analytics Professional-grade platform Industry-specific optimization","Starting at $49/month","8","1-2 hours","Contractor platforms Service systems Home management","Home Services & Contractors professionals using advanced AI for expert ai home services platform with professional contractor analysis and repair optimization","250-450%","Expert AI home services platform with professional contractor analysis and repair optimization","10","2024","true",""
"18","SalonSync AI","https://salonsync.ai","Beauty & Wellness","Hair Salons","AI appointment scheduling and client management for hair salons","Smart scheduling client preferences inventory management","Starting at $59/month","9","30 minutes","Salon management software Appointment booking Payment systems","Hair salons using AI for smart scheduling client preferences","180-320%","Smart scheduling client preferences","9.8","2023","true",""
"19","MassageFlow AI","https://massageflow.ai","Beauty & Wellness","Massage Therapy","AI therapy session optimization and client wellness tracking","Session optimization wellness tracking progress monitoring","From $69/month","8","1 hour","Salon management software Appointment booking Payment systems","Massage therapy practices using AI for session optimization wellness tracking","180-320%","Session optimization wellness tracking","9.8","2024","true",""
"20","NailTech AI Assistant","https://nailtech-ai.com","Beauty & Wellness","Nail Salons","AI nail art design recommendations and salon management platform","Design recommendations appointment scheduling inventory tracking","Starting at $39/month","8","45 minutes","Salon management software Appointment booking Payment systems","Nail salons using AI for design recommendations appointment scheduling","180-320%","Design recommendations appointment scheduling","9","2024","true",""
"21","SpaFlow AI","https://spaflow-ai.com","Beauty & Wellness","Wellness Platform","AI spa treatment scheduling and client wellness tracking","Advanced AI analytics Professional-grade platform Industry-specific optimization","Starting at $49/month","8","1-2 hours","Beauty platforms Wellness systems Treatment management","Beauty & Wellness professionals using advanced AI for ai spa treatment scheduling and client wellness tracking","280-420%","AI spa treatment scheduling and client wellness tracking","7","2024","true",""
"22","BeautyTechAI Pro","https://beautytech-ai.com","Beauty & Wellness","Beauty Analytics","Professional AI beauty services with skin analysis hair color optimization and wellness treatment planning","Advanced AI analytics Professional-grade platform Industry-specific optimization","Starting at $49/month","8","1-2 hours","Beauty platforms Wellness systems Treatment management","Beauty & Wellness professionals using advanced AI for professional ai beauty services with skin analysis hair color optimization and wellness treatment planning","280-420%","Professional AI beauty services with skin analysis hair color optimization and wellness treatment planning","10","2024","true",""
"23","WellnessAI Platform","https://wellness-ai-platform.com","Beauty & Wellness","Treatment Analysis","Comprehensive AI wellness services with spa treatment optimization and beauty analysis","Advanced AI analytics Professional-grade platform Industry-specific optimization","Starting at $49/month","8","1-2 hours","Beauty platforms Wellness systems Treatment management","Beauty & Wellness professionals using advanced AI for comprehensive ai wellness services with spa treatment optimization and beauty analysis","280-420%","Comprehensive AI wellness services with spa treatment optimization and beauty analysis","10","2024","true",""
"24","SkinCareAI Pro","https://skincare-ai.com","Beauty & Wellness","Wellness Platform","Advanced AI skin analysis with beauty treatment recommendations and wellness monitoring","Advanced AI analytics Professional-grade platform Industry-specific optimization","Starting at $49/month","8","1-2 hours","Beauty platforms Wellness systems Treatment management","Beauty & Wellness professionals using advanced AI for advanced ai skin analysis with beauty treatment recommendations and wellness monitoring","280-420%","Advanced AI skin analysis with beauty treatment recommendations and wellness monitoring","9.3","2023","true",""
"25","BeautyAnalytics AI","https://beauty-analytics.ai","Beauty & Wellness","Beauty Services","Professional AI beauty analytics with skin treatment analysis and wellness optimization","Advanced AI analytics Professional-grade platform Industry-specific optimization","Starting at $49/month","8","1-2 hours","Beauty platforms Wellness systems Treatment management","Beauty & Wellness professionals using advanced AI for professional ai beauty analytics with skin treatment analysis and wellness optimization","280-420%","Professional AI beauty analytics with skin treatment analysis and wellness optimization","10","2024","true",""
"26","MenuGenius AI","https://menugenius.ai","Food & Hospitality","Restaurants","AI menu optimization and ingredient cost analysis for restaurants","Menu optimization cost analysis demand forecasting","Starting at $79/month","8","1 hour","POS systems Inventory management Delivery platforms","Restaurants using AI for menu optimization cost analysis","120-280%","Menu optimization cost analysis","9.8","2023","true",""
"27","FoodTruck AI Navigator","https://foodtruck-ai.com","Food & Hospitality","Food Trucks","AI location optimization and route planning for food truck operators","Location optimization route planning demand prediction","From $49/month","8","45 minutes","POS systems Inventory management Delivery platforms","Food truck operators using AI for location optimization route planning","120-280%","Location optimization route planning","9.8","2024","true",""
"28","ChefBrain AI","https://chefbrain.ai","Food & Hospitality","Commercial Kitchens","AI kitchen workflow optimization and recipe scaling for commercial kitchens","Workflow optimization recipe scaling inventory management","Starting at $99/month","7","2 hours","POS systems Inventory management Delivery platforms","Commercial kitchens using AI for workflow optimization recipe scaling","120-280%","Workflow optimization recipe scaling","7.8","2024","true",""
"29","RestaurantAI Analytics","https://restaurant-analytics.ai","Food & Hospitality","Restaurant Analytics","Professional AI restaurant services with kitchen optimization food safety monitoring and hospitality analytics","Advanced AI analytics Professional-grade platform Industry-specific optimization","Starting at $49/month","8","1-2 hours","Restaurant systems Food platforms Hospitality management","Food & Hospitality professionals using advanced AI for professional ai restaurant services with kitchen optimization food safety monitoring and hospitality analytics","220-380%","Professional AI restaurant services with kitchen optimization food safety monitoring and hospitality analytics","10","2024","true",""
"30","FoodServiceAI Pro","https://foodservice-ai.com","Food & Hospitality","Food Services","Comprehensive AI food service platform with restaurant operations kitchen management and dining optimization","Advanced AI analytics Professional-grade platform Industry-specific optimization","Starting at $49/month","8","1-2 hours","Restaurant systems Food platforms Hospitality management","Food & Hospitality professionals using advanced AI for comprehensive ai food service platform with restaurant operations kitchen management and dining optimization","220-380%","Comprehensive AI food service platform with restaurant operations kitchen management and dining optimization","10","2024","true",""
"31","CulinaryAI Systems","https://culinary-ai.com","Food & Hospitality","Culinary Services","Advanced AI culinary services with restaurant planning food optimization and hospitality management","Advanced AI analytics Professional-grade platform Industry-specific optimization","Starting at $49/month","8","1-2 hours","Restaurant systems Food platforms Hospitality management","Food & Hospitality professionals using advanced AI for advanced ai culinary services with restaurant planning food optimization and hospitality management","220-380%","Advanced AI culinary services with restaurant planning food optimization and hospitality management","9.8","2023","true",""
"32","HospitalityAI Pro","https://hospitality-ai.com","Food & Hospitality","Hospitality Platform","Professional AI hospitality platform with restaurant services food analytics and dining optimization","Advanced AI analytics Professional-grade platform Industry-specific optimization","Starting at $49/month","8","1-2 hours","Restaurant systems Food platforms Hospitality management","Food & Hospitality professionals using advanced AI for professional ai hospitality platform with restaurant services food analytics and dining optimization","220-380%","Professional AI hospitality platform with restaurant services food analytics and dining optimization","10","2024","true",""
"33","ChefAI Platform","https://chef-ai-platform.com","Food & Hospitality","Culinary Services","Specialized AI kitchen services with restaurant optimization and food service management","Advanced AI analytics Professional-grade platform Industry-specific optimization","Starting at $49/month","8","1-2 hours","Restaurant systems Food platforms Hospitality management","Food & Hospitality professionals using advanced AI for specialized ai kitchen services with restaurant optimization and food service management","220-380%","Specialized AI kitchen services with restaurant optimization and food service management","9.5","2024","true",""
"34","PhysioAI Coach","https://physio-ai.com","Healthcare Specialists","Physical Therapy","AI physical therapy session planning and patient progress tracking","Exercise optimization progress tracking recovery analysis","Starting at $89/month","8","1 hour","Electronic health records Medical imaging systems Practice management","Physical therapy clinics using AI for exercise optimization progress tracking","250-450%","Exercise optimization progress tracking","9.8","2024","true",""
"35","OptometryAI Pro","https://optometry-ai.com","Healthcare Specialists","Optometry","AI vision analysis and prescription optimization for optometry practices","Vision analysis prescription optimization eye health monitoring","From $79/month","8","45 minutes","Electronic health records Medical imaging systems Practice management","Optometry practices using AI for vision analysis prescription optimization","250-450%","Vision analysis prescription optimization","9.8","2023","true",""
"36","DentalFlow AI","https://dentalflow.ai","Healthcare Specialists","Dental Practices","AI dental practice management with treatment planning and patient care","Treatment planning patient scheduling diagnostic assistance","Starting at $99/month","7","2 hours","Electronic health records Medical imaging systems Practice management","Dental practices using AI for treatment planning patient scheduling","250-450%","Treatment planning patient scheduling","9.5","2024","true",""
"37","RadiologyAI Pro","https://radiology-ai.com","Healthcare Specialists","Medical Analytics","AI medical imaging analysis and diagnosis assistance","Advanced AI analytics Professional-grade platform Industry-specific optimization","Starting at $49/month","8","1-2 hours","Healthcare systems Medical platforms Clinical management","Healthcare Specialists professionals using advanced AI for ai medical imaging analysis and diagnosis assistance","350-550%","AI medical imaging analysis and diagnosis assistance","7","2024","true",""
"38","NursingAI Assistant","https://nursing-ai.com","Healthcare Specialists","Patient Care","AI nursing care planning and patient monitoring","Advanced AI analytics Professional-grade platform Industry-specific optimization","Starting at $49/month","8","1-2 hours","Healthcare systems Medical platforms Clinical management","Healthcare Specialists professionals using advanced AI for ai nursing care planning and patient monitoring","350-550%","AI nursing care planning and patient monitoring","7","2024","true",""
"39","MedicalAI Pro Platform","https://medical-ai-pro.com","Healthcare Specialists","Healthcare Platform","Professional AI healthcare services with medical diagnostics patient monitoring and clinical analysis optimization","Advanced AI analytics Professional-grade platform Industry-specific optimization","Starting at $49/month","8","1-2 hours","Healthcare systems Medical platforms Clinical management","Healthcare Specialists professionals using advanced AI for professional ai healthcare services with medical diagnostics patient monitoring and clinical analysis optimization","350-550%","Professional AI healthcare services with medical diagnostics patient monitoring and clinical analysis optimization","10","2024","true",""
"40","HealthcareAnalytics AI","https://healthcare-analytics.ai","Healthcare Specialists","Medical Analytics","Comprehensive AI healthcare platform with medical imaging analysis and patient care optimization","Advanced AI analytics Professional-grade platform Industry-specific optimization","Starting at $49/month","8","1-2 hours","Healthcare systems Medical platforms Clinical management","Healthcare Specialists professionals using advanced AI for comprehensive ai healthcare platform with medical imaging analysis and patient care optimization","350-550%","Comprehensive AI healthcare platform with medical imaging analysis and patient care optimization","10","2024","true",""
"41","ClinicalAI Systems","https://clinical-ai.com","Healthcare Specialists","Clinical Services","Advanced AI clinical services with healthcare diagnostics and medical treatment planning","Advanced AI analytics Professional-grade platform Industry-specific optimization","Starting at $49/month","8","1-2 hours","Healthcare systems Medical platforms Clinical management","Healthcare Specialists professionals using advanced AI for advanced ai clinical services with healthcare diagnostics and medical treatment planning","350-550%","Advanced AI clinical services with healthcare diagnostics and medical treatment planning","9.8","2023","true",""
"42","TaxGenius AI","https://taxgenius.ai","Professional Services","CPA/Tax Preparation","AI tax preparation and optimization for accounting firms","Tax optimization compliance checking deduction analysis","Starting at $129/month","7","3 hours","CRM platforms Accounting software Project management tools","CPA firms using AI for tax optimization compliance checking","200-400%","Tax optimization compliance checking","9.8","2024","true",""
"43","ArchitectAI Design","https://architect-ai.com","Professional Services","Architecture","AI architectural design assistance and 3D modeling optimization","Design optimization 3D modeling building analysis","From $149/month","6","4 hours","CRM platforms Accounting software Project management tools","Architecture firms using AI for design optimization 3D modeling","200-400%","Design optimization 3D modeling","9.5","2023","true",""
"44","LawyerAI Contract","https://lawyer-ai.com","Professional Services","Small Law Practices","AI contract analysis and legal document automation for small law firms","Contract analysis document automation legal research","Starting at $99/month","7","2 hours","CRM platforms Accounting software Project management tools","Small law firms using AI for contract analysis document automation","200-400%","Contract analysis document automation","8","2024","true",""
