id,name,url,category,subcategory,description,keyFeatures,startingPrice,easeOfUse,setupTime,integrations,useCase,industryROI,specialization,specializationScore,founded,isAINative,urlStatus
"91","SmartBuild AI","https://smartbuildai.com","Construction & Engineering","Project Management","Professional project scheduling assistant with machine learning capabilities for Construction & Engineering","Intelligent project scheduling Automated project scheduling analysis Real-time project scheduling optimization","Starting at $99/month","8","1 hour","Project management CAD software Safety systems","Construction & Engineering professionals using advanced AI for project scheduling","200-450%","project scheduling","8.5","2023","true","valid"
"92","ProConstruction Pro","https://proconstructionpro.com","Construction & Engineering","Safety Monitoring","Specialized AI tool for safety analysis optimization in the Construction & Engineering industry","Intelligent safety analysis Automated safety analysis analysis Real-time safety analysis optimization","Starting at $119/month","7","45 minutes","Project management CAD software Safety systems","Construction & Engineering professionals using advanced AI for safety analysis","200-450%","safety analysis","8.8","2024","true","valid"
"93","AIEngineering Analytics","https://aiengineeringanalytics.com","Construction & Engineering","Cost Estimation","AI-powered cost prediction platform designed specifically for Construction & Engineering professionals","Intelligent cost prediction Automated cost prediction analysis Real-time cost prediction optimization","Starting at $139/month","7","45 minutes","Project management CAD software Safety systems","Construction & Engineering professionals using advanced AI for cost prediction","200-450%","cost prediction","8.9","2023","true","valid"
"94","AutoProject Platform","https://autoprojectplatform.com","Construction & Engineering","Quality Assurance","Specialized AI tool for quality inspection optimization in the Construction & Engineering industry","Intelligent quality inspection Automated quality inspection analysis Real-time quality inspection optimization","Starting at $159/month","9","1 hour","Project management CAD software Safety systems","Construction & Engineering professionals using advanced AI for quality inspection","200-450%","quality inspection","8.5","2024","true","valid"
"95","SmartTravel AI","https://smarttravelai.com","Travel & Tourism","Booking Optimization","AI-powered pricing optimization platform designed specifically for Travel & Tourism professionals","Intelligent pricing optimization Automated pricing optimization analysis Real-time pricing optimization optimization","Starting at $49/month","7","1-2 hours","Booking systems Travel platforms CRM software","Travel & Tourism professionals using advanced AI for pricing optimization","150-350%","pricing optimization","9","2023","true","valid"
"96","ProTourism Pro","https://protourismpro.com","Travel & Tourism","Experience Planning","Advanced itinerary planning solution with intelligent automation for Travel & Tourism businesses","Intelligent itinerary planning Automated itinerary planning analysis Real-time itinerary planning optimization","Starting at $69/month","7","1 hour","Booking systems Travel platforms CRM software","Travel & Tourism professionals using advanced AI for itinerary planning","150-350%","itinerary planning","8.5","2024","true","valid"
"97","AIJourney Analytics","https://aijourneyanalytics.com","Travel & Tourism","Customer Service","Industry-leading AI platform for customer insights enhancement in Travel & Tourism","Intelligent customer insights Automated customer insights analysis Real-time customer insights optimization","Starting at $89/month","9","15 minutes","Booking systems Travel platforms CRM software","Travel & Tourism professionals using advanced AI for customer insights","150-350%","customer insights","8.5","2024","true","valid"
"98","AutoDestination Platform","https://autodestinationplatform.com","Travel & Tourism","Revenue Management","Specialized AI tool for demand forecasting optimization in the Travel & Tourism industry","Intelligent demand forecasting Automated demand forecasting analysis Real-time demand forecasting optimization","Starting at $109/month","7","2 hours","Booking systems Travel platforms CRM software","Travel & Tourism professionals using advanced AI for demand forecasting","150-350%","demand forecasting","8.9","2024","true","valid"
"99","SmartDev AI","https://smartdevai.com","AI Development & Tech","API Management","Advanced API optimization solution with intelligent automation for AI Development & Tech businesses","Intelligent API optimization Automated API optimization analysis Real-time API optimization optimization","Starting at $79/month","8","30 minutes","Development platforms Cloud services AI frameworks","AI Development & Tech professionals using advanced AI for API optimization","300-600%","API optimization","9","2024","true","valid"
"100","ProTech Pro","https://protechpro.com","AI Development & Tech","AI Model Training","Industry-leading AI platform for model training enhancement in AI Development & Tech","Intelligent model training Automated model training analysis Real-time model training optimization","Starting at $99/month","8","30 minutes","Development platforms Cloud services AI frameworks","AI Development & Tech professionals using advanced AI for model training","300-600%","model training","8.5","2023","true","valid"
"101","NexusLegal Intelligence","https://nexuslegalintelligence.com","Legal & Compliance","Contract Intelligence","Enterprise-grade AI platform for contract analysis automation specifically engineered for Legal & Compliance professionals","Enterprise contract analysis automation automation Advanced contract analysis automation intelligence Predictive contract analysis automation modeling","Starting at $149/month","7","1 hour","Legal software Case management systems Compliance platforms","Legal & Compliance professionals using advanced AI for contract analysis automation","300-700%","contract analysis automation","9.9","2024","true","valid"
"102","QuantumCompliance Analytics","https://quantumcomplianceanalytics.com","Legal & Compliance","Regulatory Compliance","Enterprise-grade AI platform for regulatory monitoring specifically engineered for Legal & Compliance professionals","Enterprise regulatory monitoring automation Advanced regulatory monitoring intelligence Predictive regulatory monitoring modeling","Starting at $179/month","7","2-3 days","Legal software Case management systems Compliance platforms","Legal & Compliance professionals using advanced AI for regulatory monitoring","300-700%","regulatory monitoring","9.4","2023","true","valid"
"103","NeuralRegulatory Insights","https://neuralregulatoryinsights.com","Legal & Compliance","Legal Research","Advanced machine learning solution delivering legal precedent research automation for Legal & Compliance industry leaders","Enterprise legal precedent research automation Advanced legal precedent research intelligence Predictive legal precedent research modeling","Starting at $209/month","9","1-2 hours","Legal software Case management systems Compliance platforms","Legal & Compliance professionals using advanced AI for legal precedent research","300-700%","legal precedent research","9.1","2023","true","valid"
"104","CognitiveContract Solutions","https://cognitivecontractsolutions.com","Legal & Compliance","Document Review","Intelligent compliance reporting platform with deep industry expertise for Legal & Compliance enterprises","Enterprise compliance reporting automation Advanced compliance reporting intelligence Predictive compliance reporting modeling","Starting at $239/month","7","2-3 hours","Legal software Case management systems Compliance platforms","Legal & Compliance professionals using advanced AI for compliance reporting","300-700%","compliance reporting","9.1","2024","true","valid"
"105","NexusAuto Intelligence","https://nexusautointelligence.com","Automotive & Transportation","Fleet Optimization","Next-generation AI solution revolutionizing predictive maintenance in the Automotive & Transportation sector","Enterprise predictive maintenance automation Advanced predictive maintenance intelligence Predictive predictive maintenance modeling","Starting at $89/month","8","2-3 hours","Fleet management Telematics systems GPS platforms","Automotive & Transportation professionals using advanced AI for predictive maintenance","200-500%","predictive maintenance","9.5","2024","true","valid"
"106","QuantumTransport Analytics","https://quantumtransportanalytics.com","Automotive & Transportation","Autonomous Systems","Enterprise-grade AI platform for route optimization specifically engineered for Automotive & Transportation professionals","Enterprise route optimization automation Advanced route optimization intelligence Predictive route optimization modeling","Starting at $119/month","9","2-3 days","Fleet management Telematics systems GPS platforms","Automotive & Transportation professionals using advanced AI for route optimization","200-500%","route optimization","9.4","2023","true","valid"
"107","NeuralFleet Insights","https://neuralfleetinsights.com","Automotive & Transportation","Maintenance Prediction","Enterprise-grade AI platform for vehicle diagnostics specifically engineered for Automotive & Transportation professionals","Enterprise vehicle diagnostics automation Advanced vehicle diagnostics intelligence Predictive vehicle diagnostics modeling","Starting at $149/month","9","1 week","Fleet management Telematics systems GPS platforms","Automotive & Transportation professionals using advanced AI for vehicle diagnostics","200-500%","vehicle diagnostics","8.9","2024","true","valid"
"108","CognitiveVehicle Solutions","https://cognitivevehiclesolutions.com","Automotive & Transportation","Route Intelligence","Intelligent driver behavior analysis platform with deep industry expertise for Automotive & Transportation enterprises","Enterprise driver behavior analysis automation Advanced driver behavior analysis intelligence Predictive driver behavior analysis modeling","Starting at $179/month","7","2-3 hours","Fleet management Telematics systems GPS platforms","Automotive & Transportation professionals using advanced AI for driver behavior analysis","200-500%","driver behavior analysis","9.3","2024","true","valid"
"109","NexusEnergy Intelligence","https://nexusenergyintelligence.com","Energy & Utilities","Smart Grid Management","Next-generation AI solution revolutionizing energy demand forecasting in the Energy & Utilities sector","Enterprise energy demand forecasting automation Advanced energy demand forecasting intelligence Predictive energy demand forecasting modeling","Starting at $199/month","7","2-3 hours","SCADA systems Smart meters Energy management platforms","Energy & Utilities professionals using advanced AI for energy demand forecasting","250-600%","energy demand forecasting","9.7","2023","true","valid"
"110","QuantumPower Analytics","https://quantumpoweranalytics.com","Energy & Utilities","Energy Forecasting","Advanced machine learning solution delivering grid optimization automation for Energy & Utilities industry leaders","Enterprise grid optimization automation Advanced grid optimization intelligence Predictive grid optimization modeling","Starting at $229/month","7","1-2 hours","SCADA systems Smart meters Energy management platforms","Energy & Utilities professionals using advanced AI for grid optimization","250-600%","grid optimization","9.6","2024","true","valid"
"111","NeuralGrid Insights","https://neuralgridinsights.com","Energy & Utilities","Asset Monitoring","Next-generation AI solution revolutionizing renewable integration in the Energy & Utilities sector","Enterprise renewable integration automation Advanced renewable integration intelligence Predictive renewable integration modeling","Starting at $259/month","8","1 day","SCADA systems Smart meters Energy management platforms","Energy & Utilities professionals using advanced AI for renewable integration","250-600%","renewable integration","9.1","2024","true","valid"
"112","CognitiveUtility Solutions","https://cognitiveutilitysolutions.com","Energy & Utilities","Demand Response","Intelligent asset performance monitoring platform with deep industry expertise for Energy & Utilities enterprises","Enterprise asset performance monitoring automation Advanced asset performance monitoring intelligence Predictive asset performance monitoring modeling","Starting at $289/month","8","1 day","SCADA systems Smart meters Energy management platforms","Energy & Utilities professionals using advanced AI for asset performance monitoring","250-600%","asset performance monitoring","9.4","2023","true","valid"
"113","NexusMedia Intelligence","https://nexusmediaintelligence.com","Media & Publishing","Content Generation","Professional AI system optimizing content personalization processes for Media & Publishing organizations","Enterprise content personalization automation Advanced content personalization intelligence Predictive content personalization modeling","Starting at $59/month","7","2-3 days","CMS platforms Analytics tools Publishing systems","Media & Publishing professionals using advanced AI for content personalization","180-400%","content personalization","8.9","2023","true","valid"
"114","QuantumContent Analytics","https://quantumcontentanalytics.com","Media & Publishing","Audience Analytics","Advanced machine learning solution delivering audience segmentation automation for Media & Publishing industry leaders","Enterprise audience segmentation automation Advanced audience segmentation intelligence Predictive audience segmentation modeling","Starting at $89/month","9","1 hour","CMS platforms Analytics tools Publishing systems","Media & Publishing professionals using advanced AI for audience segmentation","180-400%","audience segmentation","8.9","2024","true","valid"
"115","NeuralPublishing Insights","https://neuralpublishinginsights.com","Media & Publishing","Personalization","Intelligent content optimization platform with deep industry expertise for Media & Publishing enterprises","Enterprise content optimization automation Advanced content optimization intelligence Predictive content optimization modeling","Starting at $119/month","7","1 day","CMS platforms Analytics tools Publishing systems","Media & Publishing professionals using advanced AI for content optimization","180-400%","content optimization","9.4","2024","true","valid"
"116","CognitiveDigital Solutions","https://cognitivedigitalsolutions.com","Media & Publishing","Rights Management","Advanced machine learning solution delivering rights tracking automation for Media & Publishing industry leaders","Enterprise rights tracking automation Advanced rights tracking intelligence Predictive rights tracking modeling","Starting at $149/month","8","2-3 hours","CMS platforms Analytics tools Publishing systems","Media & Publishing professionals using advanced AI for rights tracking","180-400%","rights tracking","9.2","2024","true","valid"
"117","NexusTelecom Intelligence","https://nexustelecomintelligence.com","Telecommunications","Network Optimization","Enterprise-grade AI platform for network performance optimization specifically engineered for Telecommunications professionals","Enterprise network performance optimization automation Advanced network performance optimization intelligence Predictive network performance optimization modeling","Starting at $159/month","9","1 hour","Network management OSS/BSS systems Monitoring platforms","Telecommunications professionals using advanced AI for network performance optimization","250-550%","network performance optimization","9.6","2023","true","valid"
"118","QuantumNetwork Analytics","https://quantumnetworkanalytics.com","Telecommunications","Customer Experience","Advanced machine learning solution delivering churn prediction automation for Telecommunications industry leaders","Enterprise churn prediction automation Advanced churn prediction intelligence Predictive churn prediction modeling","Starting at $189/month","7","1 week","Network management OSS/BSS systems Monitoring platforms","Telecommunications professionals using advanced AI for churn prediction","250-550%","churn prediction","9.7","2023","true","valid"
"119","NeuralWireless Insights","https://neuralwirelessinsights.com","Telecommunications","Fraud Detection","Enterprise-grade AI platform for fraud detection specifically engineered for Telecommunications professionals","Enterprise fraud detection automation Advanced fraud detection intelligence Predictive fraud detection modeling","Starting at $219/month","7","1 week","Network management OSS/BSS systems Monitoring platforms","Telecommunications professionals using advanced AI for fraud detection","250-550%","fraud detection","9.1","2023","true","valid"
"120","CognitiveConnectivity Solutions","https://cognitiveconnectivitysolutions.com","Telecommunications","Capacity Planning","Enterprise-grade AI platform for capacity forecasting specifically engineered for Telecommunications professionals","Enterprise capacity forecasting automation Advanced capacity forecasting intelligence Predictive capacity forecasting modeling","Starting at $249/month","7","2-3 hours","Network management OSS/BSS systems Monitoring platforms","Telecommunications professionals using advanced AI for capacity forecasting","250-550%","capacity forecasting","9.7","2024","true","valid"
"121","NexusSecurity Intelligence","https://nexussecurityintelligence.com","Security & Surveillance","Threat Detection","Professional AI system optimizing threat intelligence processes for Security & Surveillance organizations","Enterprise threat intelligence automation Advanced threat intelligence intelligence Predictive threat intelligence modeling","Starting at $119/month","9","1 hour","Security systems SIEM platforms Access control systems","Security & Surveillance professionals using advanced AI for threat intelligence","300-650%","threat intelligence","9.5","2023","true","valid"
"122","QuantumGuard Analytics","https://quantumguardanalytics.com","Security & Surveillance","Video Analytics","Advanced machine learning solution delivering behavioral analytics automation for Security & Surveillance industry leaders","Enterprise behavioral analytics automation Advanced behavioral analytics intelligence Predictive behavioral analytics modeling","Starting at $149/month","9","1 hour","Security systems SIEM platforms Access control systems","Security & Surveillance professionals using advanced AI for behavioral analytics","300-650%","behavioral analytics","9.5","2024","true","valid"
"123","NeuralMonitor Insights","https://neuralmonitorinsights.com","Security & Surveillance","Access Control","Next-generation AI solution revolutionizing anomaly detection in the Security & Surveillance sector","Enterprise anomaly detection automation Advanced anomaly detection intelligence Predictive anomaly detection modeling","Starting at $179/month","8","1 hour","Security systems SIEM platforms Access control systems","Security & Surveillance professionals using advanced AI for anomaly detection","300-650%","anomaly detection","9.1","2024","true","valid"
"124","CognitiveProtect Solutions","https://cognitiveprotectsolutions.com","Security & Surveillance","Incident Response","Intelligent incident prediction platform with deep industry expertise for Security & Surveillance enterprises","Enterprise incident prediction automation Advanced incident prediction intelligence Predictive incident prediction modeling","Starting at $209/month","8","1-2 hours","Security systems SIEM platforms Access control systems","Security & Surveillance professionals using advanced AI for incident prediction","300-650%","incident prediction","9.7","2024","true","valid"
"125","NexusEco Intelligence","https://nexusecointelligence.com","Environmental & Sustainability","Carbon Tracking","Advanced machine learning solution delivering carbon footprint analysis automation for Environmental & Sustainability industry leaders","Enterprise carbon footprint analysis automation Advanced carbon footprint analysis intelligence Predictive carbon footprint analysis modeling","Starting at $79/month","8","1 week","Environmental systems Monitoring devices Reporting platforms","Environmental & Sustainability professionals using advanced AI for carbon footprint analysis","200-450%","carbon footprint analysis","9.1","2024","true","valid"
"126","QuantumGreen Analytics","https://quantumgreenanalytics.com","Environmental & Sustainability","Resource Optimization","Intelligent resource optimization platform with deep industry expertise for Environmental & Sustainability enterprises","Enterprise resource optimization automation Advanced resource optimization intelligence Predictive resource optimization modeling","Starting at $109/month","9","2-3 days","Environmental systems Monitoring devices Reporting platforms","Environmental & Sustainability professionals using advanced AI for resource optimization","200-450%","resource optimization","9.2","2024","true","valid"
"127","NeuralSustain Insights","https://neuralsustaininsights.com","Environmental & Sustainability","Environmental Monitoring","Advanced machine learning solution delivering environmental compliance automation for Environmental & Sustainability industry leaders","Enterprise environmental compliance automation Advanced environmental compliance intelligence Predictive environmental compliance modeling","Starting at $139/month","8","1 week","Environmental systems Monitoring devices Reporting platforms","Environmental & Sustainability professionals using advanced AI for environmental compliance","200-450%","environmental compliance","8.7","2024","true","valid"
"128","CognitiveCarbon Solutions","https://cognitivecarbonsolutions.com","Environmental & Sustainability","Sustainability Reporting","Next-generation AI solution revolutionizing sustainability metrics in the Environmental & Sustainability sector","Enterprise sustainability metrics automation Advanced sustainability metrics intelligence Predictive sustainability metrics modeling","Starting at $169/month","8","2-3 hours","Environmental systems Monitoring devices Reporting platforms","Environmental & Sustainability professionals using advanced AI for sustainability metrics","200-450%","sustainability metrics","8.7","2023","true","valid"
"129","NexusSport Intelligence","https://nexussportintelligence.com","Sports & Recreation","Performance Analytics","Advanced machine learning solution delivering performance optimization automation for Sports & Recreation industry leaders","Enterprise performance optimization automation Advanced performance optimization intelligence Predictive performance optimization modeling","Starting at $49/month","7","1 hour","Sports analytics Venue systems Fan platforms","Sports & Recreation professionals using advanced AI for performance optimization","150-350%","performance optimization","9.2","2024","true","valid"
"130","QuantumAthletic Analytics","https://quantumathleticanalytics.com","Sports & Recreation","Fan Engagement","Enterprise-grade AI platform for fan engagement analytics specifically engineered for Sports & Recreation professionals","Enterprise fan engagement analytics automation Advanced fan engagement analytics intelligence Predictive fan engagement analytics modeling","Starting at $79/month","8","1 day","Sports analytics Venue systems Fan platforms","Sports & Recreation professionals using advanced AI for fan engagement analytics","150-350%","fan engagement analytics","9.1","2023","true","valid"
"131","NeuralPerformance Insights","https://neuralperformanceinsights.com","Sports & Recreation","Venue Management","Enterprise-grade AI platform for facility management specifically engineered for Sports & Recreation professionals","Enterprise facility management automation Advanced facility management intelligence Predictive facility management modeling","Starting at $109/month","8","1 day","Sports analytics Venue systems Fan platforms","Sports & Recreation professionals using advanced AI for facility management","150-350%","facility management","8.7","2024","true","valid"
"132","CognitiveFitness Solutions","https://cognitivefitnesssolutions.com","Sports & Recreation","Injury Prevention","Intelligent injury prediction platform with deep industry expertise for Sports & Recreation enterprises","Enterprise injury prediction automation Advanced injury prediction intelligence Predictive injury prediction modeling","Starting at $139/month","8","1 hour","Sports analytics Venue systems Fan platforms","Sports & Recreation professionals using advanced AI for injury prediction","150-350%","injury prediction","9.3","2024","true","valid"
"133","NexusGov Intelligence","https://nexusgovintelligence.com","Government & Public Sector","Citizen Services","Next-generation AI solution revolutionizing citizen service optimization in the Government & Public Sector sector","Enterprise citizen service optimization automation Advanced citizen service optimization intelligence Predictive citizen service optimization modeling","Starting at $99/month","8","1-2 hours","Government systems Public databases Emergency platforms","Government & Public Sector professionals using advanced AI for citizen service optimization","200-500%","citizen service optimization","9.4","2024","true","valid"
